{
  "card_version": "1.0",
  "agent_id": "conductor-dev:doc-gen",
  "name": "Documentation Generator",
  "auth_scope": "trusted",
  "allowed_callers": [
    "local",
    "telegram_bot",
    "n8n_workflows",
    "c2_remote"
  ],
  "data_classification_clearance": "public",
  "issued_at": "2026-05-11T00:00:00Z",
  "card_hash": "PENDING_FIRST_BUILD"
}
