{
  "card_version": "1.0",
  "agent_id": "conductor-dev:database",
  "name": "Database Schema and Migration Engineer",
  "auth_scope": "trusted",
  "allowed_callers": [
    "local",
    "c2_remote"
  ],
  "data_classification_clearance": "internal",
  "issued_at": "2026-05-11T00:00:00Z",
  "card_hash": "PENDING_FIRST_BUILD"
}
